{
	"$schema": "https://json-schema.org/draft/2020-12/schema",
	"title": "TanStack Start application surface registry",
	"description": "The enumerated declaration `scripts/template/start-contract.ts` validates. A server-rendered application is the rare surface whose defects are silent: a `types` entry that does not resolve fails the typechecker and never fails the build, because esbuild ignores `types` entirely; a build-time variable missing from a deploy job's environment compiles to the literal `undefined` and every truthiness-guarded consumer just stops rendering; and a route whose asset prefix disagrees with the served directory returns 404 for rewritten URLs in the built Worker alone. So the surface is declared here — the shared TypeScript base, the server-render response policy, the worker configuration, the built-artifact shape, the router options, the asset namespace and the per-application route tree — and reconciled against the tree. `mode` is the load-bearing field: `skeleton` asserts, positively, that no application of this stack exists anywhere in the tracked tree; `active` asserts every declared artefact exists and runs every rule over it.",
	"type": "object",
	"additionalProperties": false,
	"required": [
		"schemaVersion",
		"mode",
		"tsconfigPath",
		"devServer",
		"viteDevWaiver",
		"proxyRegistryPath",
		"types",
		"forbiddenTypes",
		"ssr",
		"worker",
		"build",
		"router",
		"apps"
	],
	"properties": {
		"schemaVersion": {
			"type": "integer",
			"const": 1
		},
		"mode": {
			"description": "The declared tree state. It is compared with the derived state before any other rule runs, and a disagreement in either direction is the first error.",
			"type": "string",
			"enum": ["skeleton", "active"]
		},
		"tsconfigPath": {
			"description": "The shared TypeScript base every application of this stack extends. In every mode it must exist, be an ordinary in-tree file with exactly one hard link, and extend the repository base — a base that restates a weaker option set while calling itself strict is the defect this registry exists to make visible.",
			"$ref": "#/$defs/relativePath"
		},
		"devServer": {
			"description": "The runtime a developer actually runs this stack under. It is declared rather than assumed because the two answers differ in kind: the built worker under the pinned Cloudflare CLI exercises the production artefact, while a bundler dev server resolves modules at request time and fails server renders with `Cannot find module` on internal subpath imports that the build bundles. The second answer is a refusal a reasoned waiver may lift.",
			"type": "string",
			"enum": ["wrangler", "vite"]
		},
		"viteDevWaiver": {
			"description": "The reasoned waiver that lifts the development-server refusal, or null. A waiver keeps the finding a decision rather than an obstacle: the guard prints the reason it was given, so the next reader inherits the argument instead of rediscovering the defect.",
			"type": ["object", "null"],
			"additionalProperties": false,
			"required": ["reason"],
			"properties": {
				"reason": {
					"type": "string",
					"minLength": 24
				}
			}
		},
		"proxyRegistryPath": {
			"description": "The development proxy route registry this surface reconciles against. It belongs to a declared capability dependency rather than to this capability, so it is READ as data with a named notice when it is absent and never imported — a generation-time dependency guarantee expires at generation, and a static import would turn a diagnostic into a module-load crash in a tree a downstream project is free to create.",
			"$ref": "#/$defs/relativePath"
		},
		"types": {
			"description": "The `compilerOptions.types` entries the shared base declares. Empty is the correct answer for this stack: modern routers register route types through declaration merging rather than through an ambient global type library, and a worker environment is modelled structurally in an ambient declaration file the application owns.",
			"type": "array",
			"uniqueItems": true,
			"items": { "type": "string", "minLength": 1 }
		},
		"forbiddenTypes": {
			"description": "Type entries that must never appear, whether or not they resolve. The reserved entry is the one this stack shipped with: it named a subpath the router package does not export, so the typechecker failed with TS2688 while the build stayed green, because esbuild ignores `types`.",
			"type": "array",
			"uniqueItems": true,
			"items": { "type": "string", "minLength": 1 }
		},
		"ssr": {
			"description": "The server-render response policy, declared as a matrix rather than discovered from a handler.",
			"type": "object",
			"additionalProperties": false,
			"required": [
				"mode",
				"streamingWaiver",
				"methods",
				"methodRejection",
				"cacheControl",
				"determinism"
			],
			"properties": {
				"mode": {
					"description": "Buffered or streaming. Buffered is the declared default because streaming backpressure and abort behaviour on this worker runtime is unproven, which is a statement about a date rather than a law — so streaming is a refusal a reasoned waiver may lift.",
					"type": "string",
					"enum": ["buffered", "streaming"]
				},
				"streamingWaiver": {
					"type": ["object", "null"],
					"additionalProperties": false,
					"required": ["reason"],
					"properties": {
						"reason": {
							"type": "string",
							"minLength": 24
						}
					}
				},
				"methods": {
					"description": "The methods a document route serves. Exactly GET and HEAD: a document is a read, and HEAD is answered with GET semantics minus the body.",
					"type": "array",
					"minItems": 1,
					"uniqueItems": true,
					"items": { "type": "string", "minLength": 3 }
				},
				"methodRejection": {
					"description": "What any other method receives. A 405 naming the methods it would have accepted, because a document route that answers 404 to a POST has told the caller the wrong thing.",
					"type": "object",
					"additionalProperties": false,
					"required": ["status", "allowHeader"],
					"properties": {
						"status": {
							"type": "integer",
							"minimum": 400,
							"maximum": 499
						},
						"allowHeader": {
							"type": "string",
							"minLength": 1
						}
					}
				},
				"cacheControl": {
					"description": "The cache directive every response class carries — 200, 302, 4xx and 5xx alike. These payloads are per-user and must never be shared-cached, and a directive applied to the success path alone is the version of this rule that leaks.",
					"type": "string",
					"minLength": 1
				},
				"determinism": {
					"description": "The fixed timezone and locale the server render and the first client render share. A locale or timezone drift between the two is a classic hydration-mismatch source, and it presents as an unrelated flake rather than as an error.",
					"type": "object",
					"additionalProperties": false,
					"required": ["timezone", "locale"],
					"properties": {
						"timezone": { "type": "string", "minLength": 1 },
						"locale": { "type": "string", "minLength": 2 }
					}
				}
			}
		},
		"worker": {
			"description": "The source worker configuration every declared application writes by hand.",
			"type": "object",
			"additionalProperties": false,
			"required": [
				"compatibilityDate",
				"compatibilityFlags",
				"workersDev",
				"previewUrls",
				"serviceBindings",
				"forbiddenBindingKinds",
				"harnessOnlyVariables"
			],
			"properties": {
				"compatibilityDate": {
					"description": "One fleet-consistent date rather than whichever default the scaffolding emitted, so two workers in one repository cannot disagree about runtime semantics.",
					"type": "string",
					"pattern": "^\\d{4}-\\d{2}-\\d{2}$"
				},
				"compatibilityFlags": {
					"description": "Must contain the Node compatibility flag: the server bundle of this stack requires it, and without it the worker fails at module evaluation rather than at a request.",
					"type": "array",
					"minItems": 1,
					"uniqueItems": true,
					"items": { "type": "string", "minLength": 1 }
				},
				"workersDev": {
					"description": "Pinned false. A workers.dev subdomain is a second public origin nobody enumerated.",
					"type": "boolean"
				},
				"previewUrls": {
					"description": "Pinned false, for the same reason.",
					"type": "boolean"
				},
				"serviceBindings": {
					"description": "The closed allowlist of service bindings. A binding absent from this list is refused rather than warned about: the whole safety argument of a narrow binding set is that a leak between two services is structurally impossible, and one undeclared binding dissolves it.",
					"type": "array",
					"uniqueItems": true,
					"items": {
						"type": "object",
						"additionalProperties": false,
						"required": ["binding", "service"],
						"properties": {
							"binding": {
								"type": "string",
								"pattern": "^[A-Z][A-Z0-9_]*$"
							},
							"service": { "$ref": "#/$defs/identifier" }
						}
					}
				},
				"forbiddenBindingKinds": {
					"description": "Binding families that must be absent or empty in both the source configuration and the built artefact.",
					"type": "array",
					"minItems": 1,
					"uniqueItems": true,
					"items": { "type": "string", "minLength": 1 }
				},
				"harnessOnlyVariables": {
					"description": "Variables a test harness injects that must never reach a deploy artefact. A harness oracle shipped to production is a hard failure and not a warning.",
					"type": "array",
					"uniqueItems": true,
					"items": {
						"type": "string",
						"pattern": "^[A-Z][A-Z0-9_]*$"
					}
				}
			}
		},
		"build": {
			"description": "The build outputs and the contract over the generated worker configuration. These are the artefacts a deploy ships, and the only proof of a build that is portable to a template with no application.",
			"type": "object",
			"additionalProperties": false,
			"required": [
				"outputDirectory",
				"clientDirectory",
				"serverModule",
				"builtConfigPath",
				"assetsDirectory",
				"assetsPrefix",
				"buildTimeVariables"
			],
			"properties": {
				"outputDirectory": { "$ref": "#/$defs/relativePath" },
				"clientDirectory": { "$ref": "#/$defs/relativePath" },
				"serverModule": {
					"description": "The entry module name inside the generated server directory, as the generated worker configuration spells it.",
					"$ref": "#/$defs/relativePath"
				},
				"builtConfigPath": { "$ref": "#/$defs/relativePath" },
				"assetsDirectory": {
					"description": "The asset directory the generated worker configuration declares, relative to itself.",
					"type": "string",
					"minLength": 1
				},
				"assetsPrefix": {
					"description": "The emitted asset directory every application shares. Rewriting document URLs to a different prefix does not move the physical directory the asset binding serves, which made every rewritten URL 404 in the built worker while the development server stayed green.",
					"type": "string",
					"minLength": 1
				},
				"buildTimeVariables": {
					"description": "Variables the bundler INLINES at build time. If a deploy job omits one from the build step's environment the expression compiles to the literal `undefined`, the bundle ships, the worker boots, nothing throws, and every truthiness-guarded consumer silently stops rendering. There is no runtime signal anywhere.",
					"type": "array",
					"uniqueItems": true,
					"items": {
						"type": "string",
						"pattern": "^[A-Z][A-Z0-9_]*$"
					}
				}
			}
		},
		"router": {
			"description": "The router options that are decisions rather than defaults.",
			"type": "object",
			"additionalProperties": false,
			"required": [
				"defaultPreload",
				"defaultErrorComponent",
				"scrollRestoration",
				"caseSensitive"
			],
			"properties": {
				"defaultPreload": {
					"description": "Router-wide speculation, pinned false. Only source-audited high-frequency link sites should preload on intent.",
					"type": "boolean"
				},
				"defaultErrorComponent": {
					"description": "Whether every route carries an error boundary. Without one the router installs NO catch boundary for a match, so a render throw escapes to the nearest ancestor gate and is misreported as a session failure — or, on a public route, hits nothing at all.",
					"type": "boolean"
				},
				"scrollRestoration": { "type": "boolean" },
				"caseSensitive": { "type": "boolean" }
			}
		},
		"apps": {
			"description": "Every application of this stack. Empty is the declared answer for a template that generates none, and `mode` is what makes that assertion rather than silence.",
			"type": "array",
			"uniqueItems": true,
			"items": { "$ref": "#/$defs/app" }
		}
	},
	"$defs": {
		"relativePath": {
			"type": "string",
			"minLength": 1,
			"pattern": "^[A-Za-z0-9._][A-Za-z0-9._/-]*$"
		},
		"identifier": {
			"type": "string",
			"minLength": 1,
			"pattern": "^[a-z][a-z0-9-]*$"
		},
		"app": {
			"description": "One application of this stack. Every path field except `directory` is relative to `directory`, so an application can be moved without rewriting its own declaration.",
			"type": "object",
			"additionalProperties": false,
			"required": [
				"id",
				"directory",
				"basePath",
				"routerBasepath",
				"assetsDir",
				"serverEntry",
				"clientEntry",
				"routerModule",
				"routeTree",
				"wranglerConfig",
				"ambientDeclarations",
				"clientOnlyModules",
				"proxyRouteId"
			],
			"properties": {
				"id": { "$ref": "#/$defs/identifier" },
				"directory": {
					"description": "The application directory. The naming rule is enforced rather than suggested, because a directory that does not match is a directory the deploy-coverage oracle cannot map to a job — and renaming a job away from its directory is a violation rather than a silent skip.",
					"type": "string",
					"pattern": "^apps/[a-z0-9-]+-start$"
				},
				"basePath": {
					"description": "The public prefix the bundler serves this application under, always with a trailing slash.",
					"type": "string",
					"pattern": "^/(?:[A-Za-z0-9._-]+/)*$"
				},
				"routerBasepath": {
					"description": "The router basepath, which is the public prefix without its trailing slash. Declared separately because the two are spelled differently in two files and drift between them is invisible until a route 404s in the built worker.",
					"type": "string",
					"pattern": "^/(?:[A-Za-z0-9._-]+(?:/[A-Za-z0-9._-]+)*)?$"
				},
				"assetsDir": {
					"description": "The emitted asset directory, which must equal the shared prefix.",
					"type": "string",
					"minLength": 1
				},
				"serverEntry": { "$ref": "#/$defs/relativePath" },
				"clientEntry": { "$ref": "#/$defs/relativePath" },
				"routerModule": { "$ref": "#/$defs/relativePath" },
				"routeTree": {
					"description": "The generated route tree. It is governed as a COMMITTED artefact rather than a regenerable one: tracked, absent from the ignore list, and excluded from the formatter and the linter, because the generator emits casts and unorganized imports in its raw style and a freshly built tree fails a lint pass that a checked-in copy does not.",
					"$ref": "#/$defs/relativePath"
				},
				"wranglerConfig": { "$ref": "#/$defs/relativePath" },
				"ambientDeclarations": {
					"description": "The ambient declaration files this application owns. They are what replaces a global type library: the worker environment is modelled structurally so the application never needs a platform types package in its empty `types` list.",
					"type": "array",
					"minItems": 1,
					"uniqueItems": true,
					"items": { "$ref": "#/$defs/relativePath" }
				},
				"clientOnlyModules": {
					"description": "Modules that must not enter the server bundle. A server graph and a client graph are different graphs and the difference is declared rather than discovered: a dependency that does not build on the worker runtime enters through a dynamic import the server build eliminates.",
					"type": "array",
					"uniqueItems": true,
					"items": { "$ref": "#/$defs/relativePath" }
				},
				"proxyRouteId": {
					"description": "The route id in the development proxy registry that fronts this application, or null. Declared by id and reconciled only when that registry is present.",
					"type": ["string", "null"],
					"pattern": "^[a-z][a-z0-9-]*$"
				}
			}
		}
	}
}
